{
  "$schema": "http://json-schema.org/draft-07/schema#",
  "title": "n8n SDLC Project Configuration",
  "description": "Project-level configuration for the n8n SDLC system. Created by the get-started wizard or manually from project.json.template.",
  "type": "object",
  "required": ["n8nProjectId", "naming", "version"],
  "properties": {
    "$schema": {
      "type": "string"
    },
    "$comment": {
      "type": "string"
    },
    "projectName": {
      "type": "string",
      "description": "Optional human-readable project name for display purposes (dashboards, logs). Not used in workflow naming."
    },
    "n8nProjectId": {
      "type": "string",
      "minLength": 1,
      "description": "n8n project ID from the workflow URL (projectId=...). Used to lock all MCP operations to this project via n8n_list_workflows and verified via n8n_get_workflow shared[0].projectId."
    },
    "naming": {
      "type": "object",
      "required": ["devPrefix"],
      "properties": {
        "devPrefix": {
          "type": "string",
          "default": "DEV-",
          "description": "Prefix prepended to workflow names for development copies. PROD workflows keep their original name with no prefix."
        }
      },
      "additionalProperties": false
    },
    "workflowsDir": {
      "type": "string",
      "default": "",
      "description": "Base directory for workflow JSON files, relative to workspace root. Empty string or omitted means workspace root (agents/ and tools/ at top level). Example: 'workflows/' stores files under workflows/agents/ and workflows/tools/."
    },
    "discoveryMode": {
      "type": "string",
      "enum": ["master", "full-project"],
      "description": "How workflows were discovered during setup. 'master': traced from a single entry-point workflow. 'full-project': pulled all workflows in the n8n project. Omit for greenfield projects."
    },
    "masterWorkflowId": {
      "type": "string",
      "description": "The n8n workflow ID of the master (entry-point) workflow. Only set when discoveryMode is 'master'. Used by n8n-sdlc-import-project to begin traversal."
    },
    "folderStrategy": {
      "type": "object",
      "description": "Controls how workflow JSON files are organized locally. Set during the get-started wizard.",
      "properties": {
        "mode": {
          "type": "string",
          "enum": ["flat", "categorized"],
          "default": "flat",
          "description": "flat: agents/ and tools/ only. categorized: nested hierarchy based on dependency graph and workflow type."
        },
        "dedicatedTools": {
          "type": "string",
          "enum": ["flat", "grouped", "alongside"],
          "default": "flat",
          "description": "Only used when mode=categorized. flat: all tools in tools/. grouped: tools/{parent-name}/. alongside: same folder as calling agent."
        }
      },
      "additionalProperties": false
    },
    "tags": {
      "type": "object",
      "properties": {
        "dev": {
          "type": "array",
          "items": { "type": "string" },
          "description": "Tags applied to DEV workflows"
        },
        "prod": {
          "type": "array",
          "items": { "type": "string" },
          "description": "Tags applied to PROD workflows"
        }
      },
      "additionalProperties": false
    },
    "credentials": {
      "type": "object",
      "description": "Map credential aliases to their environment-specific n8n IDs. Only for credentials that differ between dev and prod. During promotion, iterate aliases and replace any node credential whose ID matches the 'dev' value with the 'prod' value. Security note: these are opaque n8n-internal reference IDs, not secrets. Actual credential secrets (API keys, tokens, passwords) are stored in n8n's encrypted credential vault and are never exposed here. project.json is gitignored by default.",
      "additionalProperties": {
        "type": "object",
        "required": ["dev", "prod"],
        "properties": {
          "dev": {
            "type": "string",
            "description": "n8n credential ID for dev environment"
          },
          "prod": {
            "type": "string",
            "description": "n8n credential ID for prod environment"
          }
        },
        "additionalProperties": false
      }
    },
    "git": {
      "type": "object",
      "description": "Git sync settings for the project repo. Controls automatic commit/push after SDLC operations and the branch model.",
      "properties": {
        "enabled": {
          "type": "boolean",
          "default": true,
          "description": "Whether to auto-commit and push after SDLC operations. Set to false to disable all git sync."
        },
        "devBranch": {
          "type": "string",
          "default": "dev",
          "description": "Branch name for day-to-day development. All push/pull/seed operations commit here."
        },
        "mainBranch": {
          "type": "string",
          "default": "main",
          "description": "Branch name that mirrors production state. Updated via PR after promotions."
        },
        "autoPush": {
          "type": "boolean",
          "default": true,
          "description": "Whether to auto-push to remote after each commit. If false, commits are local only until manually pushed."
        }
      },
      "additionalProperties": false
    },
    "slotCreator": {
      "type": "object",
      "description": "Optional config for automated slot creation via helper workflow. When configured, the reserve skill can auto-create empty workflow slots instead of requiring manual creation in the n8n UI.",
      "properties": {
        "webhookUrl": {
          "type": "string",
          "format": "uri",
          "description": "Webhook URL of the slot-creator helper workflow deployed in your n8n instance."
        }
      },
      "additionalProperties": false
    },
    "createdAt": {
      "type": "string",
      "format": "date-time",
      "description": "ISO 8601 timestamp when this project was initialized"
    },
    "version": {
      "type": "string",
      "description": "Schema version for forward compatibility"
    }
  },
  "additionalProperties": false
}
